{
  "schemaVersion": "plan/v1",
  "summary": {
    "confidence": "high",
    "verificationCommand": "swift test",
    "blockerCount": 0,
    "addTestCount": 3,
    "extendTestCount": 0,
    "deferredCount": 0
  },
  "blockers": [],
  "items": [
    {
      "id": "add-test:Sources/App/Controllers/PriceController.swift",
      "action": "add-test",
      "targetId": "Sources/App/Controllers/PriceController.swift",
      "target": "PriceController",
      "path": "Sources/App/Controllers/PriceController.swift",
      "testLevel": "integration",
      "priority": 4,
      "riskReductionScore": 9,
      "maintenanceCost": 5,
      "rationale": [
        "HTTP route behavior",
        "Vapor request handling",
        "database access behavior",
        "MongoDB-specific query semantics",
        "aggregation pipeline semantics",
        "Use an isolated test database, apply the owning migrations, and clean up persisted state between cases.",
        "Seed representative MongoDB fixture data and assert aggregation grouping, ordering, and edge-case result shape."
      ],
      "sourceSignals": [
        "http-route",
        "vapor-route",
        "database-access",
        "database-driver-mongodb",
        "mongodb-aggregation",
        "mongodb-query"
      ],
      "existingTestPaths": []
    },
    {
      "id": "add-test:Sources/App/Controllers/SearchController.swift",
      "action": "add-test",
      "targetId": "Sources/App/Controllers/SearchController.swift",
      "target": "SearchController",
      "path": "Sources/App/Controllers/SearchController.swift",
      "testLevel": "integration",
      "priority": 4,
      "riskReductionScore": 9,
      "maintenanceCost": 5,
      "rationale": [
        "HTTP route behavior",
        "Vapor request handling",
        "database access behavior",
        "Fluent query semantics",
        "MongoDB-specific query semantics",
        "dynamic BSON filter construction",
        "pagination or sorting behavior",
        "Use an isolated test database, apply the owning migrations, and clean up persisted state between cases.",
        "Cover dynamic BSON filter construction with escaped user input, empty results, and malformed query boundaries.",
        "Assert pagination and sorting boundaries, including limits, offsets, stable ordering, and has-next-page behavior."
      ],
      "sourceSignals": [
        "http-route",
        "vapor-route",
        "database-access",
        "database-driver-mongodb",
        "database-read",
        "fluent-query",
        "mongodb-dynamic-filter",
        "mongodb-query",
        "pagination-or-sort"
      ],
      "existingTestPaths": []
    },
    {
      "id": "add-test:Sources/App/Jobs/PriceHistoryJob.swift",
      "action": "add-test",
      "targetId": "Sources/App/Jobs/PriceHistoryJob.swift",
      "target": "PriceHistoryJob",
      "path": "Sources/App/Jobs/PriceHistoryJob.swift",
      "testLevel": "integration",
      "priority": 3,
      "riskReductionScore": 8,
      "maintenanceCost": 5,
      "rationale": [
        "Database access boundary",
        "database access behavior",
        "Fluent query semantics",
        "MongoDB-specific query semantics",
        "database write/update behavior",
        "Use an isolated test database, apply the owning migrations, and clean up persisted state between cases.",
        "Exercise create, update, and delete paths for idempotency, constraints, duplicate data, and existing-record updates."
      ],
      "sourceSignals": [
        "data-access",
        "database-access",
        "database-driver-mongodb",
        "database-read",
        "database-write",
        "fluent-query",
        "mongodb-query",
        "mongodb-write"
      ],
      "existingTestPaths": []
    }
  ]
}
