{
  "schemaVersion": "plan/v1",
  "summary": {
    "confidence": "low",
    "blockerCount": 2,
    "addTestCount": 2,
    "extendTestCount": 0,
    "deferredCount": 1
  },
  "blockers": [
    "No supported JS test framework detected.",
    "No runnable test command detected from package scripts or framework config."
  ],
  "items": [
    {
      "id": "add-test:src/paymentParser.ts",
      "action": "add-test",
      "targetId": "src/paymentParser.ts",
      "target": "paymentParser",
      "path": "src/paymentParser.ts",
      "testLevel": "unit",
      "priority": 7,
      "riskReductionScore": 9,
      "maintenanceCost": 2,
      "rationale": [
        "Pure transformation logic",
        "edge-case surface"
      ],
      "sourceSignals": [
        "pure-logic",
        "edge-case-surface"
      ],
      "existingTestPaths": []
    },
    {
      "id": "add-test:src/paymentClient.ts",
      "action": "add-test",
      "targetId": "src/paymentClient.ts",
      "target": "paymentClient",
      "path": "src/paymentClient.ts",
      "testLevel": "unit",
      "priority": 4,
      "riskReductionScore": 8,
      "maintenanceCost": 4,
      "rationale": [
        "Service boundary",
        "external dependency boundary",
        "auth or permission branches"
      ],
      "sourceSignals": [
        "service-name",
        "external-boundary",
        "auth-branch"
      ],
      "existingTestPaths": []
    },
    {
      "id": "defer:src/paymentResponseDto.ts",
      "action": "defer",
      "targetId": "src/paymentResponseDto.ts",
      "target": "paymentResponseDto",
      "path": "src/paymentResponseDto.ts",
      "testLevel": "none",
      "priority": -2,
      "riskReductionScore": 2,
      "maintenanceCost": 4,
      "rationale": [
        "DTO-only models are usually better covered through boundary parsing or mapper tests.",
        "Cover through API/client parsing, mapper tests, or route integration tests."
      ],
      "sourceSignals": [
        "dto-only"
      ],
      "existingTestPaths": []
    }
  ]
}
