{
  "schemaVersion": "plan/v1",
  "summary": {
    "confidence": "high",
    "verificationCommand": "gradle test",
    "blockerCount": 0,
    "addTestCount": 1,
    "extendTestCount": 1,
    "deferredCount": 1
  },
  "blockers": [],
  "items": [
    {
      "id": "extend-test:src/main/kotlin/com/example/checkout/CheckoutCalculator.kt",
      "action": "extend-test",
      "targetId": "src/main/kotlin/com/example/checkout/CheckoutCalculator.kt",
      "target": "CheckoutCalculator",
      "path": "src/main/kotlin/com/example/checkout/CheckoutCalculator.kt",
      "testLevel": "unit",
      "priority": 7,
      "riskReductionScore": 9,
      "maintenanceCost": 2,
      "rationale": [
        "Pure transformation logic",
        "edge-case surface",
        "Existing test file detected; review missing edge cases"
      ],
      "sourceSignals": [
        "pure-logic",
        "edge-case-surface",
        "matching-test"
      ],
      "existingTestPaths": [
        "src/test/kotlin/com/example/checkout/CheckoutCalculatorTest.kt"
      ]
    },
    {
      "id": "add-test:src/main/java/com/example/checkout/MoneyFormatter.java",
      "action": "add-test",
      "targetId": "src/main/java/com/example/checkout/MoneyFormatter.java",
      "target": "MoneyFormatter",
      "path": "src/main/java/com/example/checkout/MoneyFormatter.java",
      "testLevel": "unit",
      "priority": 7,
      "riskReductionScore": 9,
      "maintenanceCost": 2,
      "rationale": [
        "Pure transformation logic",
        "edge-case surface"
      ],
      "sourceSignals": [
        "pure-logic",
        "edge-case-surface"
      ],
      "existingTestPaths": []
    },
    {
      "id": "defer:src/main/kotlin/com/example/checkout/CheckoutRequest.kt",
      "action": "defer",
      "targetId": "src/main/kotlin/com/example/checkout/CheckoutRequest.kt",
      "target": "CheckoutRequest",
      "path": "src/main/kotlin/com/example/checkout/CheckoutRequest.kt",
      "testLevel": "none",
      "priority": -2,
      "riskReductionScore": 2,
      "maintenanceCost": 4,
      "rationale": [
        "DTO-only models are usually better covered through boundary parsing or mapper tests.",
        "Cover through parser, mapper, repository, or route integration tests that consume the model."
      ],
      "sourceSignals": [
        "dto-only"
      ],
      "existingTestPaths": []
    }
  ]
}
