{
  "schemaVersion": "plan/v1",
  "summary": {
    "confidence": "high",
    "verificationCommand": "pytest",
    "blockerCount": 0,
    "addTestCount": 1,
    "extendTestCount": 1,
    "deferredCount": 1
  },
  "blockers": [],
  "items": [
    {
      "id": "extend-test:src/checkout/calculator.py",
      "action": "extend-test",
      "targetId": "src/checkout/calculator.py",
      "target": "calculator",
      "path": "src/checkout/calculator.py",
      "testLevel": "unit",
      "priority": 7,
      "riskReductionScore": 9,
      "maintenanceCost": 2,
      "rationale": [
        "Pure transformation logic",
        "edge-case surface",
        "Existing test file detected; review missing edge cases"
      ],
      "sourceSignals": [
        "pure-logic",
        "edge-case-surface",
        "matching-test"
      ],
      "existingTestPaths": [
        "src/checkout/tests/test_calculator.py"
      ]
    },
    {
      "id": "add-test:src/checkout/discount_service.py",
      "action": "add-test",
      "targetId": "src/checkout/discount_service.py",
      "target": "discount_service",
      "path": "src/checkout/discount_service.py",
      "testLevel": "unit",
      "priority": 2,
      "riskReductionScore": 6,
      "maintenanceCost": 4,
      "rationale": [
        "Service boundary"
      ],
      "sourceSignals": [
        "service-boundary"
      ],
      "existingTestPaths": []
    },
    {
      "id": "defer:src/checkout/checkout_response.py",
      "action": "defer",
      "targetId": "src/checkout/checkout_response.py",
      "target": "checkout_response",
      "path": "src/checkout/checkout_response.py",
      "testLevel": "none",
      "priority": -2,
      "riskReductionScore": 2,
      "maintenanceCost": 4,
      "rationale": [
        "DTO-only models are usually better covered through route, parser, or service tests.",
        "Cover through parser, mapper, repository, or route integration tests that consume the model."
      ],
      "sourceSignals": [
        "dto-only"
      ],
      "existingTestPaths": []
    }
  ]
}
